{
  "$schema": "../schema.json",
  "name": "oldworld",
  "roles": {
    "canvas": "#131313",
    "surface-active": "#1D1D20",
    "surface-chrome": "#27272a",
    "surface-highlight": "#2D2D31",
    "surface-extend": "@accent-primary",
    "surface-fold": "@accent-info",
    "surface-heading-h1": "#3C2F38",
    "surface-heading-h2": "#2C303A",
    "surface-heading-h3": "#3D342F",
    "surface-tint-rose": "#3E2930",
    "copy-mode-indicator": "#6c6874",
    "divider-subtle": "#27272a",
    "text": "#c9c7cd",
    "text-ui": "#b4b1ba",
    "text-muted": "#6c6874",
    "text-default": "#b4b1ba",
    "accent-primary": "#ea83a5",
    "accent-secondary": "#92a2d5",
    "accent-tertiary": "#e29eca",
    "accent-highlight": "#b4b1ba",
    "accent-info": "#85b5ba",
    "accent-periwinkle": "#92a2d5",
    "accent-warn": "#e6b99d",
    "accent-amber": "#e6b99d",
    "selection-bg": "#6c6874",
    "selection-fg": "#c8c7cd",
    "split-divider": "#6c6874",
    "bar-text": "#c9c7cd",
    "bar-canvas": "#131313"
  },
  "ansi": [
    "#27272a",
    "#ea83a5",
    "#90b99f",
    "#e6b99d",
    "#92a2d5",
    "#e29eca",
    "#85b5ba",
    "#c9c7cd",
    "#6c6874",
    "#ea83a5",
    "#90b99f",
    "#e6b99d",
    "#92a2d5",
    "#e29eca",
    "#85b5ba",
    "#b4b1ba"
  ],
  "ghostty": {
    "background": "@canvas",
    "foreground": "#c9c7cd",
    "selection-background": "#6c6874",
    "selection-foreground": "#c8c7cd",
    "cursor-color": "#c9c7cd",
    "cursor-text": "#161617"
  },
  "native": {
    "nvim": "oldworld",
    "zed": "Oldworld"
  },
  "opacity": {
    "border-active": 0.70
  }
}
